commentedBy,commentMessage,upvotes,commentDate
Lillian Eunice Lecca Rafael,"Do I need some aditional library for this expression ?  , I have the next problem :  Error: unexpected '&' in ""DT[UniqueCarrier==&""

 

DT[UniqueCarrier==&quot;AA&quot;]",1,26/03/2018 08:05 AM
skohari,"the assignment operator is showing additional characters like ""&lt"". Similarly, for quote marks. Can this be fixed? It's hindering the understanding of the syntax. Thanks.",1,30/05/2018 06:54 PM
Zac Konstas,"The tutorial is very helpful, thanks.


Fixing the quotes and lt yourself doesn't feel like a big deal.. There's only 2 or 3 types of issues.",1,28/11/2018 03:35 AM
Ngan Nguyen,There is a typo. In a data.frame doing this DF[2:5] would *NOT give all the rows of the 2nd to 5th column.,1,05/06/2019 11:25 PM
