commentedBy,commentMessage,upvotes,commentDate
DEVRAJ REDKAR,from where can we obtain a dataset for this?,1,14/06/2018 11:34 AM
Prabhakar Krishnamurthy,"Dear Phillips, Thank you very much for developing a packages for heart patients. Is it possible to do it for epilepsy? Regards ",1,24/05/2019 11:38 AM
Prabhakar Krishnamurthy,"Dear Phillips, I am trying to load library and I get the following message. 

> library(""FFTrees"")

Error: package or namespace load failed for ‘FFTrees’ in loadNamespace(j <- i[[1L]], c(lib.loc, .libPaths()), versionCheck = vI[[j]]):

 there is no package called ‘GlobalOptions’",1,24/05/2019 11:47 AM
Yvonne Matthews,"Could one use fftrees for a non-binary decision? E.g. a decision task with 3 alternatives. I suppose I could represent it as sequential binary decisions but then I'd have multiple trees.


",1,04/06/2019 01:52 PM
