commentedBy,commentMessage,upvotes,commentDate
Hani Mounla,Very nice !,3,08/06/2018 06:45 PM
Thushan Ganegedara,The code for this tutorial can be found here,3,16/06/2018 03:57 PM
Sayak Paul,That was neat and precise. Thanks Thushan. ,2,24/07/2018 02:49 PM
Steven Lei,"Thank you, it works for me!",1,14/09/2018 01:00 PM
Varsha Waingankar,Very nice tutorial! Thanks Thushan!,1,12/10/2018 09:30 PM
kamran khan,if any one help me. i want to connect tensor board with mysql database. and i fetch data from database,1,30/04/2019 12:21 AM
James Lin,A lot of useful information. Thanks.,1,06/06/2019 04:52 AM
